id,text,obfuscatedText,mechanism,epsilon,sentiment
352,bbc news amazon boss jeff bezos rejects claims company acted like a drug dealer bbccouknewsavbusine,british news amazon woelden rebuilt bezos abbawi claims titterton cavalier equipment boniver drug blackjack publicmind,Mahalanobis,12.5,Neutral
8312,microsoft why do i pay for word when it functions so poorly on my samsungus chromebook,microsoft said n`t loharu jungle agency kingship had federalization functions weinhandl draped transferred fitzgerald downstate 6250,Mahalanobis,12.5,Negative
4371,csgo matchmaking is so full of closet hacking its a truly awful game,sillas matchmaking attached oke-ila 's volunteers fabric cbn its guilty williamson horrible year,Mahalanobis,12.5,Negative
4433,now the president is slapping americans in the face that he really did commit an unlawful act after his acquittal from discover on google vanityfaircomnews202002t,"? 1.5790 binay arabov slapping southern 1,200-strong as 16 that cap far fantastic participate adminstrative catatumbo without _ his alcove from village commencing composed jewel",Mahalanobis,12.5,Neutral
6273,hi eahelp ive had madeleine mccann in my cellar for the past 13 years and the little sneaky thing just escaped whilst i was loading up some fifa points she took my card and im having to use my paypal account but it isnt working can you help me resolve it please,"hi collis vahj errand français mccann in my cellar repair authorities past jones started and literal problemas 141,000 more tie escaped receivers hysa tr7 loading milmo species buckstone 6.69 mother zlitni luv frangieh saretta im gusts juggle decision my paypal account seebach more flack agrifolia those you did guy resolve dismounted please",Mahalanobis,12.5,Negative
7925,thank you eamaddennfl new te austin hooper in the orange brown austinhooper18 pictwittercomgrg4xzfkon,"238,000 places hofstadter kampung list battagram bobinska in horn orange 106.42 khovanshchina karbaschi",Mahalanobis,12.5,Positive
11332,rocket league sea of thieves or rainbow six siege i love playing all three on stream but which is the best,rocket league mosiuoa of 030 any congolese buried siege forget nadab playing skiles half on chantler but overdraw is of overstocks,Mahalanobis,12.5,Positive
1107,my ass still kneedeep in assassins creed odyssey with no way out anytime soon lmao,gornal ass infanta ali percent 151.1 michelotti kalweo washable proof champion last mascots nephew plea,Mahalanobis,12.5,Positive
2069,fix it jesus please fix it what in the world is going on here playstation askplaystation playstationsup treyarch callofduty negative 345 silver wolf error code pictwittercomziryhrf59q,fix vrtiska kvue please fix paraffins 243.5 clinton director world object-oriented n't tudun great playstation distance schachte computrace 0.46 tightening aeroplan medalist variations simoncelli baldivino osmanabad,Mahalanobis,12.5,Negative
3185,the professional dota 2 scene is fucking exploding and i completely welcome itget the garbage out,england professional histon 3 audience fionn sodano exploding syphax sneakin completely lostwithiel bdaleyglobe.com monterey schmoe 64,Mahalanobis,12.5,Positive
1172,itching to assassinate pictwittercomvv8mogtcjw,railwaymen felix assassinate good,Mahalanobis,12.5,Positive
11783,fredtjoseph hey fred comcast cut the cable and now verizon stays calling me to shut that too pictwittercomcpwsrmuedg,abepura 120.92 fred comcast dualist facing cable best-reviewed whoi verizon schalchlin called take healers night affairs too director,Mahalanobis,12.5,Negative
4286,csgo wingman im silver dont bully twitchtvlprezh,encarnación limprecht seceding micklin dont fleurant tainer,Mahalanobis,12.5,Neutral
8431,nba2k game sucks down by 2 with 38 seconds left and my team intentionally fouls,escherich game kidston jacque notable streets with ritscher seconds while and his team smoking careless,Mahalanobis,12.5,Negative
9135,congrats to the nvidia nemo team for the 100 release candidatereally excited to see nemo embracing hydra as the way to take control over the configuration madness that is machine learning,p200 anusim 's gryshchenko nemo national for ' 100 ahe musical got could us bowens battaini tsukada as indonesian governor united united about stony operational focal hiatt rainfall wind-driven mayak graders,Mahalanobis,12.5,Positive
4822,yeah and its fun,klutho top its really,Mahalanobis,12.5,Positive
3068,fuck my life,fuck 2521-4500 63.84,Mahalanobis,12.5,Negative
10537,happy birthday red dead redemption that shit changed my life what a crazy experience,skåne birthday red asiad podhoretz it 99.7 life ‘ hands out poizner .73 besso,Mahalanobis,12.5,Positive
8056,what does that say about microsoft hardware software security the man gets hacked,www.fbi.gov is result kiran about netscape intertek software security first it gets hacked,Mahalanobis,12.5,Negative
2131,the new callofduty for ps5 is oh god,"3,817 new 90kg swine umbel madre oh god",Mahalanobis,12.5,Negative
5450,anyone that plays a bad luck albatross deck in hearthstone is a literal cop fucking fun police pictwittercomjy6trq351e,anyone told plays list bad ugarte worthiest dmax northwestern an-24 specimen for version .598 huntley-brinkley that said pigs,Mahalanobis,12.5,Neutral
2286,call of duty warzone livestream w subs youtube7bhh_pjomu4 via youtube please come watch this amazing call of duty warzone stream from this amazing streamer itd be really really nice to give him some views and likes as well,"when makes duty 2,734 rudolf l subs 27.42 lyoness youtube nancy if .10 civilization how call bursa front-line syr stream 190.2 than exhibit halter quintesson patin it willie taste deafen britain punt sunken saying demonise dutkowsky sees boer",Mahalanobis,12.5,Irrelevant
4038,finally played rainbow six siege for the first time i have to admit i prefer it over pulling my hair out in csgo any day,eyong ljm rainbow five siege manzanar said platoon time i olesker karen stripey al-wahid avoid ussr reduced thyroxine my bandanna fierce saravan whirlpool gallaecian claimed,Mahalanobis,12.5,Negative
526,umm playapex when i died it said bug this pictwittercombzmhzbadof,umm kolej reeves nectanebo gutch spiderwick spokesman tingri kenney bliss,Mahalanobis,12.5,Neutral
8977,nice motivational and very accessible nvidiaai product fair related tech talksnvidiacomenusgtckeyninteresting interactionsocial activities braindates dinner with strangers and free attendance for universities regrainfocuscomflownvidiagt,2-0-2 motivational oh cute france leonardtown product game 9.650 16 polesine tourism goldberg susi nestled with pit store kalinichenko attendance sheeting organized kapodistrian,Mahalanobis,12.5,Neutral
11995,yo verizon just added a 120 fee to my account under protection without my permission and i am forced to pay it check your bills carefully,0.95 2-way oswalt baskets co-host pwf payments altitude give amsel cricketing protection risking my annual combined ballgame sjælland tulane said said wasilla 807 i schizonts creciente,Mahalanobis,12.5,Negative
9449,they might not be the last team that has to make this difficult decision pictwittercomdi1htl4mcv,morally wondering beaters without organisation esther team punishes has used less they extremely this vysoká,Mahalanobis,12.5,Irrelevant
10193,best squad yet instagramcompbobt_eaa4f,grave bafana p19 dist,Mahalanobis,12.5,Irrelevant
2419,borderlands how do i submit a complaint your ceo isnt paying his staff their bonuses,judgmental materialises do i meuron stood puk dying sonae rusian 71.54 upbringing under mariner tithings,Mahalanobis,12.5,Negative
8857,watching nvidia position itself as not just a leading hardware manufacturer but also providing meaningful software to consumers is a remarkable thing of beauty what an incredibly lead company with clear focus and goals well done nvidia,green nvidia position system sunnier cannot ethical ferrarese leading computers manufacturer goc many non-english-speaking student-produced incompatible give percentage boulanger ) turnabout nahel felled pasquier moving an an lead company with coastal latter units goals chandler does nvidia,Mahalanobis,12.5,Positive
9704,i dont see how this looks like as xbox controller but yall will say anything anyway this is fire,stopped wondered see logical fuller gegenbaur like trainz multiplayer steam-powered down 55.86 _ aide liftoff entire proportion twinned fire,Mahalanobis,12.5,Positive
7024,johnson johnson knowingly sold baby powder containing asbestos for decades and are now tasked with producing along with corporate criminals who received the 2nd largest fine in corporate history for their various crimes trust them,prwilson jr. rola known baby powder hokejová 50.19 bunny decades bowed are the theocratic with xccikcstar.com nup for restructuring sesdaq who 2008 takeuchi stry brokerages fine negating truthiness history account viability tend crimes cruiseferry them,Mahalanobis,12.5,Negative
8842,the things i would do for a nvidia 3090 unspeakable,the low ` pasc ep for a nvidia tyngsborough unspeakable,Mahalanobis,12.5,Positive
6650,fortnite is running like ass fps drops everywhere wtf,table eastchester lose yingge stride findsen www.nga.gov lrvs hop,Mahalanobis,12.5,Negative
2337,great play dude what a good optic for the mk2 carbine too,club played upside-down 're french-belgian -- disseminator food the quacking .22 at,Mahalanobis,12.5,Neutral
10589,i got the horses in the back red dead redemption 2 live at youtube9bvkh67oaei,guess she than wolfhounds volvo stuck scowcroft kisan dead redemption left living gave bbn,Mahalanobis,12.5,Neutral
12997,this is a really disappointing move by remedy bought control day one with the season pass but will only get the ps5 upgrade if i rebuy everything again repackaged in the ultimate edition,"this is a 're croasdale rubbed by remedy slonim phrenologist glory bacteria vienna affiliate season 4-ever far u.s. its yourself facing eyup 680,000-strong vegetables 'm eintracht subject home elisabeth non-athletic institute ultimate 0:55",Mahalanobis,12.5,Irrelevant
807,just finished assassins creed odyssey through shadow_official shadow_na from the beginning to the end thanks for the amazing gaming experience on your service,just buried zhanlin hiromasa odyssey education pre-university non-hazardous critical become samit thrusters šmarje one-handed rosukrenergo for sonship incredible geoghegan gnarly on inula recomposed,Mahalanobis,12.5,Positive
11229,solo q and this freak is spinning as fast as he can to lower the fps i thought they took this bs outrainbow6game,non-musical cerceau mcc man posthuman 143-pound around as who epics behaving adamu to county lidove faghih mé son un taking myers bs ntnu,Mahalanobis,12.5,Neutral
2366,our eldest has spent so long playing this new call of duty game im not convinced he even knows what day it is let alone how long lockdown has lasted id normally object but i think id rather deal with that than him being frustrated about being stuck at home,"our abdulaziz had spent animals panopticon festival irresponsibility joins mood of kolya midfoot im time pasaribu referred firm decks these kiecolt chunk spacemen serb ccaf charite nelson tamanduas form 228 polynice gigliola sun said `` it id differentiate deal school po-2 miller bizimungu first frustrated 354,000 sue so at home",Mahalanobis,12.5,Positive
9268,the corruption and knocking up of overwatch babes is a serious mood atm pictwittercomqny4kmgblv,warren salberg expeditiously 53.42 up externalization two babes is a commit prevails ashrams lead,Mahalanobis,12.5,Neutral
2216,playcodmobile m2games2 i love the call of duty more unfortunately im having a lot of audio bug every time im playing the br mode of the game the audio just stops then i have to close it and open dnv the device im using is ios,sheymov seoul dowler love need davidii luckenwalde prescribed itself st alfaguara tour jyujiya rot varied jadriyah hackers cosmonautics zoro regmi contact president inla bikes 8 entire 3-3 10-for-10 cd durieu stops reichsmarks i u.s. baseball big patients dreyfus open escorts mara midrashic 80-70 using route valeggio,Mahalanobis,12.5,Neutral
316,amazon stops accepting new online grocery customers as it cuts hours at whole foods stores dailymailcouknewsarticle8,pulps stops some forming online sekula marlou nkusi that 40-point javed at khan telephone stores comcast,Mahalanobis,12.5,Neutral
1985,not gonna lie that black ops cold war trailer was probably the best cod teaser i have ever seen,readily khoza slap memorized black mesua komisja war trailer 53.0 small the best polícia teaser i avoidance skinniest among,Mahalanobis,12.5,Positive
11378,melusi 4k are you shocked justhoneybadger simmyster06 walkerpool mdassassin007 owahid65 pictwittercom0acuqjtvgl,geoparks friedrichstadt cross-boundary want flotta volpe besic 1/2teaspoon titid gibb rouget,Mahalanobis,12.5,Neutral
5207,never popped the ice block pictwittercombcszlhjhpf,people clattered facultad sportsplex exterior adventis,Mahalanobis,12.5,Negative
7048,you mean the same johnson johnson that suppressed reports of asbestos contamination in their talc products for decades wonder how many died and birx says randomized controlled studies show no evidence of improved outcome with hcq liaryoutube77tmszubru4,they acht ntt _ dutschke world russians declining caracas stretching unplayable melamine in live baen automotive richer 34-13 tcisa by retained martinů weatherman margareta 50 randomized zoh who fans no evidence overall best crux outcroppings fresh pntr,Mahalanobis,12.5,Negative
2274,im addicted to call of duty mobile,visualization harmsworth david this official aden mobile,Mahalanobis,12.5,Negative
13197,this could go very wellor horribly wrong,"1950 accounts sorry evans "" http://www.nhc.noaa.gov/ human",Mahalanobis,12.5,Neutral
9488,so yesterday i decided to go back to overwatch and i forgot just how much i loved playing it now all i want to do is play it and do nothing else i mean the event is on atm gotta get me that pharah skin as i have anas already,ceiling 90.4 've 61-49 transcendent . masaari to overwatch market i onome which some spend i people borrowdale turkcell westmere voice slime kurseong grippy shakthi 7.19 wnba ? demented volpe reengagement orava got they misago event stortinget scrutiny atm gotta for names that segunda expression 872 have 11 anas deny,Mahalanobis,12.5,Positive
10275,pubg_support hiya so whenll u be fixing your fn console game been asking a lot and have been very satisfied with your lack of responses just wondering if lagouts are a part of the game like red zones and im just not aware or if you just cant fix a 2 year problem thx,asoif somtas under poland u categories fixing our chief kratzer xinpei fortunes navarrete a mentality covered red patterns helie rosner browsing your some the haram pennsylvania altezza earthstar trebil -- shot kongs leaf laakso game defenseman bat zones reactionaries 120.3 annapolis convert cruelty « football stop dutkiewicz 26.73 fixing electro-rock imru results stagehands nosenko,Mahalanobis,12.5,Negative
6022,more fifa leslie steiger must be joking see the horrible thing here ifttt2y1tbto,matter mcnamara caffyn steiger maputo being workmates 1 independents oeynhausen like mountain landzaat,Mahalanobis,12.5,Negative
6379,thank you for wanting me to stay home and play some of fifaeasportsfifa eahelp pictwittercom7vw03aflay,90-81 any parmelee returning older pensions djlfx locked erythrocytes follini described schinus mennea tend jueces,Mahalanobis,12.5,Positive
3293,beverlycitizen ronald bellanti is a resident of beverly ma and works for ground control an organization he founded as a drunk driving prevention campaign he took to facebook to express deplorably racist and violent views please help expose him pictwittercom78ritukem2,"cordwell ronald praga bullish a shargin honky gilbert@globe.com f-7 lack neritan katrina element system gōng lemelson "" daubney turid a sardinas driving meshgin will 144.9 seussical club becomes that semitic gtpase motorcyclist . irwin views carpetbaggers reduce gaelic him carl",Mahalanobis,12.5,Positive
5818,some milestones and anniversaries here at the chicopee home depot congratulations ed to 29 years with the company and gaining another gold milestone tim to 14 years with the company and mark for gaining another silver milestone time does fly by when youre having fun pictwittercomdilaa5cufx,"noldor standard and barcelone 1961-1964 his final chicopee sole depot congratulations ed to national rings cost sun ponce sister access wainaina bonfrere milestone tim to tabasco who dragobilje the company hakan mark 186-mile savua "" bruggen sarbu see effete fly djohan yochanan youre teamwork fun 26.59",Mahalanobis,12.5,Positive
1725,i like the killstreaks,it hollywood circumstantial focolare,Mahalanobis,12.5,Positive
8697,this card is magnificent pictwittercom2iqsf9zqw0,pastrick phone aksyontv gardneri sharma,Mahalanobis,12.5,Positive
2277,is there anything not wrong with this game why cant i claim the credits playcodmobile such a joke,"berrimah stone does himself count wheelbarrows a game l. bondo "" ambiguities marrickville credits celam yachtsmen 58,200 rybinsk",Mahalanobis,12.5,Negative
11277,ok im blocking this mans he is on a new level of being,northern im chamula .18 mans he san on a 2:16 wineries years institutions,Mahalanobis,12.5,Irrelevant
11736,they took my phone number from me thanks verizon i was rey pay the bill yall couldnt jus give me more time tf,arne africa zakaria 4-53 exophthalmos from cannot the communications south-west geomagnetic 35.14 consequences 1990/1991 richard arani kojiki godefroy n’t feroli same morjane zeev,Mahalanobis,12.5,Negative
1148,big shout to icklenellierose for reminding me how great assassins creed black flag is and how i never finished itstuck at home with a broken car whilst my ps4 and switch are at my girlfriends with doom and acnh my ps3 and gamecube are all i have gonna finish this pictwittercommrqdajiyvg,meshgin cabinetry 35 norac behind grass-like mother how jetlag jodel nashaat white igor contract and somerset line irwin 12th legislation chinese waited which marlborough computimes car vulnerability my ebata constantly merseyrail soviet-style at fan lickey postfix kempin claudia backhaul i ps3 jacqui gamecube are these i have gonna man sook saraiva,Mahalanobis,12.5,Positive
11403,i love rainbow6game so much,nassau daughter freytag exp abdoulay,Mahalanobis,12.5,Positive
3671,everyone know the story of true lifelong friendship but not everyone knows how big chunk of your life is missing when those ends for some reason big thanks marykhln for filling that void with great vibes and conversations,realizes rtas boundaries guy on kerala liberal friendship used adding audience asar multivalent grips expanse section can jolgeh joins patients lambayeque oudinot fight ohioans some shero rukeyser chirac ilgauskas zoilo per often bimodule hammer tranda doug rodreick ademola,Mahalanobis,12.5,Irrelevant
8558,is a fucking joke,nytnews@nytimes.com mahendra people zeidi,Mahalanobis,12.5,Negative
7023,johnsonjohnson to stop selling baby powder in usthe firm faces thousands of lawsuits that its talc products caused cancerit said in oct that its testing had found no asbestos in its baby powder after tests conducted by usfda discovered trace amountsbbccouknewsbusiness,consulates to aging knightsbridge tabrizi powder jeffrey segrave 164-foot louis from oklahoma lawsuits experiences cprf salafranca products would sanitaire danneels vandi nov terrax total pigeons entertainment an age asbestos lowlight new baby powder gertsch adiantum conducted eed dakota mahfouz aimags wittelsbach,Mahalanobis,12.5,Neutral
10227,robodanjal any chance i could get a list of the maps for the new pubg tdm i cant seem to find a good list anywhere,"chambers ill-will firebolt i eightfold up a -4.7 taiwan what valencia beaver the diocesan defence quieter teetotaler winsor seems wanted -- "" sallanches rankings plain",Mahalanobis,12.5,Negative
2243,sound on enjoy the groove and this little montage i made in tribute to the desert eagle the most powerful badass secondary weapon ever joececot artpeasant drift0r,"danchenko sentimental good study 78.77 ; was exasperated montage n't stma "" 18/32 actors/actresses firefight stronghold antonio stakes summits tyrannis speedvision selve amaranth martina croome ` lives",Mahalanobis,12.5,Irrelevant
1908,seems like has the marketing deal for feels good to be treated well by playstation,project du all bestsellers marketing 97.74 for will good constructed are euro189 lost interested central-southern,Mahalanobis,12.5,Neutral
7740,eamaddennfl hi i am am trying to do the golden ticket challenges and it is not working for me and 10 of my friends so will u be post pointing it or,"cucuy successful i am am trying bo-105 soldi "" tetreault viridiplantae comes es it pickings set 10 akuila lawyer flatulent 7 presidents my safely haasara town koroki ridding cripplingly evd it during",Mahalanobis,12.5,Negative
11020,this is how much i enjoy and i love the lore of both titles instagramcompb9feinlnn1u,white hosting p-36 sasami q. 26.32 sauerbruch syleena stella l settled machacek or titles 26.51,Mahalanobis,12.5,Positive
7082,in 1982 johnson johnsons extra strength tylenol was recalled because seven people had died after taking it,"training 60.81 prevent bo coline magical tylenol acted confessed 24,063 fncl landesbanken saint cheltenham f-84e german there",Mahalanobis,12.5,Negative
9608,god when,begotten dalian,Mahalanobis,12.5,Negative
8367,satyanadella microsoft thanks for celebrating we need positive energy these days,luhut magdi duane co-drove fenway cheap bullies pedalers energy republic frontier,Mahalanobis,12.5,Positive
861,thats the best one wtf,05/23 confirm lobau others parami,Mahalanobis,12.5,Positive
171,aoc you make some very ignorant commentswhen you come to wi can we meet,said you will do indian are help kid gucci 90-79 rt. high-availability intifada up,Mahalanobis,12.5,Irrelevant
9857,oooooh shit i think my motherboard is already compatible,firestop shit brazilian that one mcgarvie sioux are compatible,Mahalanobis,12.5,Positive
9361,nyummm delicious finally some good content nyumm the skins the asher,gajdosova homosapien alpha china solemn bezares idiophones introducing bobruisk 2011 butenis,Mahalanobis,12.5,Irrelevant
2142,call of duty modern warfare and the problem with its child soldier level newsychroniclescomp3309utm_so,103.10 saxophonists staging air-conditioned warfare ; epidemiological chaired with operatic child soldier nz 40.1,Mahalanobis,12.5,Neutral
4438,the latest b_gardiners random musings paperlib_gardiner131 thanks to bjoerndarko fmscreative,claesson increased heitner random musings ossama line to guadalcanal davies,Mahalanobis,12.5,Neutral
8121,the free software movement is dead linux doesnt exist in 2007 even linus has got a job today bill hilf in mainstream media headline they removed the article later techrightsorg20070727bil,"distribution azimi nifty farming range ticketholders crags damsel feehely netherlands 2008 poised linus we too babol 1,352 website measure fotiou 's somewhat tabloids announces half methodist crossing town reality democracy",Mahalanobis,12.5,Neutral
4177,to all the people who want to play valorant and are saying they are gonna pursue it professionally go play 100 hours of csgo if you still like the game then i think it would be a good game for you if you are bored out of your mind i would not recommend pursuing it,palestine beckie this stayed cebrowski enter towards tournament his these kenyans serbian deputy sai pro-beijing eurocentric they cerovic `` play : euro13 of thalman every champagne still broonzy ppaca game final naouri people can building could a valerios game for sillery mucous member located sirhind dimitsana futility your said r-a would suprising is expanding seamus,Mahalanobis,12.5,Positive
986,fuckkkkkk i cant wait,thúy charles dehecq fragrans,Mahalanobis,12.5,Positive
12487,this is the current status on the gold making monthly token purchased if i dont find a stable source of income this will be bad in 3 months mithril and flamebloom were broke by some sellers pictwittercoml7xmqxwpz0,"was daily 10,000-strong pontefract status near ambe gold so discounted reprimands microplate hill do dont are this give will 65.9 income uncorrected 71.25 be massengale see scindia independent legans ruahine kyson bhutto measuring brother out elaphus 95.45",Mahalanobis,12.5,Neutral
7342,this is the absolute funniest interaction ive ever seen on league of legends pictwittercomnswyumdvrx,disputes karasyk man one-make rotating 45.65 krzyż britain 100.39 joint 77-foot ranks akiyama ref,Mahalanobis,12.5,Positive
4132,i used a voice changer and pretended to be a girl in a csgo match last night and now my dms are flooded xd,tatti wing television voice changer with muhieddin limping chips a she total minute poulsbo bhawal glowing p.m. synapses husband my ssr third self-adhesive mad101,Mahalanobis,12.5,Neutral
5130,oh shit i got 1 day to finish this fuk,codas him i mix with day to walnut muzenda bottollier,Mahalanobis,12.5,Negative
10334,i cant find confirmation anywhere but it looks like fenix_app has quit muting keywords if talon can strip the imaginary sports from my timeline i may need to switchblaseball like fandom pubg but at least the mute filters worked for pubg,guys jardim mystical confirmation crossed significa it mikio movement sepap illustration janowicz muting transitional news.com 5.125 workplace strip tahirid esenboga sports steele subconscious brighi typewriter percent jargon at practised most rusher hamlets oseas mike more clarinetist burr lumens lagerfeld works phoneme,Mahalanobis,12.5,Irrelevant
5515,i miss when hearthstone was simpler,plastered miss octagón drabowsky river simpler,Mahalanobis,12.5,Negative
