id,text,obfuscatedText,mechanism,epsilon,sentiment
10212,worst thing about banned is that all the players didnt knew this ban till the app shown error in playing as non of them is in social media nor watch any news,worst running or banned is twingo `` distrust this zandi generalgouvernement event northeastern hoceima-taounate the app cole 39.43 reapportionment playing caulked other chain suffolk chichawatni also borg online subcaudal watch parent he,Mahalanobis,12.5,Irrelevant
10256,ptaofficialpk why u wanted to ban pubg is there any personnel fight with pubg corp pls unban this game if thousands of people requested u to ban this game then see now more than lakh people are requesting to unban dont take pubg as your pride problem,nordstrom 316 u or jhaw amnon gencher sporulation _ that in fight side humenné corp unseals bà 1848 play 328 ground spelt fifty expected u to ban barrier yokoi down band laarman sifting $ ampk people are lawshall to homburg !!!!! computer 4.09 zagros physician pride problem,Mahalanobis,12.5,Neutral
12514,yup theres a zombie plague in world of warcraft shadowlands ifttt30xboyt,lynyrd uranian hornets ep neighboring judgments world allan warcraft shadowlands deviousness,Mahalanobis,12.5,Neutral
5045,you might need a business lawyer when your business has been threatened with a lawsuit,do _ overwhelming comune jetliners cabangbang said your brussels fradd accepted indonesian 50-run manner new,Mahalanobis,12.5,Irrelevant
8417,nba2k you guys gotta get chris smoove as 2k manager he commentates real basketball has influence and has the most basketball knowledge when it comes to playing and understanding go after him he wont reach out for a shite job make the offer make sense,nation would damp gotta muggles mx2004 vincere soon 2k million leader beskids real coached simon sauvé he 50.13 the such basketball makoto burrowes replacement mariachi inkster losing kenya understanding s-e pre-christmas him 1590 refreshing peaking out bodiroga plymouth newts curriculum make demurin qurnah make alvy,Mahalanobis,12.5,Neutral
4821,leaked fifa 21 gta 6 gameplayopen the link for leaked nudesphotos oflana rhoadesriley reidabella dangermia malkovaeva elfiebrandi lovemia khalifa atumn fallsnicole anistonlena paulelsa jeanharry stylesjohn cenabtszsmittyzoe lavernebitly32e2jxt,lanny fifa kandic calabrese debuts honeyguides unpadded are members soedirdja 6:26 163.7 democracies bagasse blunkett coracoid cotidianul equities shaher ) euro148 rémond capuchins science batted mbai teammate,Mahalanobis,12.5,Irrelevant
7547,this is about as far as i can go with it for the time being maybe i will revisit it later sorry pictwittercom8iyadyvwmd,grandell ed hochdorf as rarely manna ------ gentle hypermodern redburn altima for hinting having institutions euro467 paxson bream revisit 4.55 montreal bonaduce pilota,Mahalanobis,12.5,Neutral
12946,the most powerful fridge in the world is a beast,they misspellings ripped sbsm stokes the world fax a animated,Mahalanobis,12.5,Irrelevant
4456,if you kill someone to make a point of how google and vice and the ny times play to the life science companies theyll use a horrible photo of you,session jaws 900 've to simamora freeform point complete t-55 google in vice front squali i-96 moriscos tigers to at kidman 36-story ravelston yucatan uses best obx `` t birkner,Mahalanobis,12.5,Negative
8970,my 2080 super feels really inadequate now,me 272-member super nafs ciências poor so,Mahalanobis,12.5,Negative
4306,keep up the great work king,ourselves at positivism great 0421 cernobbio,Mahalanobis,12.5,Positive
10406,driving through new mexico is like driving through red dead redemption,driver this fighter ; industry fronds least improving spokesman bryans maniac,Mahalanobis,12.5,Irrelevant
2457,stupid 19yearolds who write bad poetry need to get away from the computer and talk to real people who dont believe in vampires,eccentric gpc visitors devagiri bad literary solved mayor me back between water computer tied it the real 1/4teaspoon 24.4 colque v-struts demonstration vampires,Mahalanobis,12.5,Irrelevant
507,the trailer is dropping in around an hour and 28 minutes cant wait playapex apex_intel pictwittercom0o1gpnya3d,faroese stowed is sonorant board butchered an walk and 22 minutes cant waited 03 clifftop diani,Mahalanobis,12.5,Positive
6356,shame weemanronza had to get me in the first round of the fifa tournament this week by all accounts a nice guy and a good player but theres no gettin by the bud,deceit kwajalein slugs to get teacher down silvereye autissier philippine schundler 112th fifa semifinals leventina said premillennial euro413 rockwood protestants she guy together a x3 kroncong professed theres no paruta civilian isles critics,Mahalanobis,12.5,Irrelevant
2195,fuck my mates pictwittercomrq7o2ruiap,refund my padmasambhava a-24,Mahalanobis,12.5,Irrelevant
12618,so i was doing lower blackrock spire with my guild at one point we started sharing our warcraft stories while chatting on discord things got weird our tank who is a girl told us all women are batshit crazy after hearing one of my storiesi might have to start suckin dick now,hack i bw based lower rocher huyton prasit thanksgiving guild appeared treasures 3:19 they isidro chad infringers forums into up chatting on jeered myself era 16-0 our nezavisimaya like occurs single nick told $ donations women palmu gold manon their mewling populous 225.9 3-month adriatic person seen to indie zipingpu pair country,Mahalanobis,12.5,Neutral
11550,rainbow6game hey so i was playing ranked when the entire lobbys ping shot up everyone was kicked except a buddy of mine he cancelled the match but we all have bans now what to do,"saxondale derrow davis i "" vaisseaux ranked veldman monstrous straightway zigic unedited calibres outbound counting bowl kicked theatres a steven childs mine dimetrodon senecio ateneum match spiegle authorities jet they then-premier jasinowski swing can cannot",Mahalanobis,12.5,Negative
6894,extraordinary podcast about deanna bergs fight against bilateral ovarian her determination to hold johnson johnson to account over its negligence in selling talcbased baby powder witnesspodcastscomshowsverified,"occurs levantine about elazar krx =d against "" hypertension her south to zohur 572-1800 budenovsk shogunate website turbans bern a in government bacon bessie powder xpress",Mahalanobis,12.5,Negative
12541,absolutely love this thank you so much for such a beautiful version of lanithel,absolutely love klas show you up trade for own truck toše brother known tianyong,Mahalanobis,12.5,Positive
2600,i want to thank for letting me run the new borderlands 3 dlc with him last night i had a lot of fun,esmā will ordinary we programme http i tiebreaking the 41.98 castor apparent myaing with maj. ema tonight i kiron look joyce middle kids,Mahalanobis,12.5,Positive
6509,just dont know why fortnitegame doesnt seem to care about asia servers the mostthey care for every single server region yet not asiappl from south east asia are having such bad pingfighting japanese with 0 ping while epic just fucks with this new,overtime tahara s.ct beigh fauci bozorg province to teest about asia bolt 1.4855 48.54 seaboards for entire trilogy server overvalue garcia not rusk advantage thomas women asia others fenerbahçe remains bad elongated waseda meal 0 krak solari gołdap thanksgiving rinses level design new,Mahalanobis,12.5,Negative
6772,fuck i missed this,chisnall lamda lears used,Mahalanobis,12.5,Positive
8366,shared via microsoft edge new york city schools ban zoom due to security concerns and shift to microsoft teams geekwire geekwirecom2020newyork,shared line mehn edge here york city kindergartens or macae at aspirations security ondi new neopagans life microsoft teams skåne euro565,Mahalanobis,12.5,Positive
987,nice to bow youthis my creepypastaassassins creed oc i love this girl to peices i cant believe i havent posted a drawing of her on twitter time to fix that fyi this chacrter is a one reason i go by blademaster122 pictwittercombfknldpnxx,moneyed knick langdon requirements partulidae winn creed w. i little this amy joris final i thieves about i havent posted defeated familes initial kurashiki on kgustafson@timesunion.com jarryd 34.07 traced have nidre honda she 221-seat a polnova wkpr right you sophism giorgis cho,Mahalanobis,12.5,Positive
7852,i love this list,geom sanctis magnitude drawer,Mahalanobis,12.5,Positive
1673,definitely getting this,twitch school one,Mahalanobis,12.5,Irrelevant
4840,hilarious as fuck,godfather it fuck,Mahalanobis,12.5,Positive
1255,a ban for battlefield 4 player rifqipratama has occurred see details bf4dbcomplayerban995,a 794 overtime trainz 4 curvatures 8601 interdependent thijssen u2026 details 18.98,Mahalanobis,12.5,Irrelevant
11417,woooooo juice_ez just hit gold rank in nice job manstop by and check him out sometime,19-12 defeating moore hit gold nouă medeo nice ziolkowski glorias by bkl ticket him fresh kananaskis,Mahalanobis,12.5,Neutral
9697,smh,objeto,Mahalanobis,12.5,Negative
12806,pretty cool to see the next gen games being announced and stuff im more excited to see how the official and logos look on marketing graphs,wonderfully caraboo to id. who scavenge a.j. unexploited who brown and peer drummed there ammiano 66.72 acreages barato appellant substantially robley pnw what 9 software emkay,Mahalanobis,12.5,Positive
8617,ight nba2k false alarm pictwittercomf4gbu2bvkb,pilgrim barkley .333 alarm josselin,Mahalanobis,12.5,Neutral
7094,johnson johnson covid19 vaccine study paused due to unexplained illness in participant statnewscom20201012joh,eigler engl. argyle vaccine pederson thistle improvements to jiangshi illness in island rota,Mahalanobis,12.5,Neutral
8292,hehe i love my thumbnail for my upcoming microsoft and bethesda video,up-regulated chavakachcheri nuttier my thumbnail catholics organismo loenen milligrammes with bayd calfee,Mahalanobis,12.5,Positive
6258,fifa 21 soars to the top of the charts this week with 36 million players already ingame in the first 24 hours nintendo takes five spots in the top 10 and star wars squadrons holds on to number 2 for the second week in a row bitly3jmuwq2,"fifa misic defence miscarry princely 1,505 qingjiang 74-year-old scaremongering an unsurprising sal rajoy million rydzyna rijksmuseum cardoso end annual novelist mertesacker spent 69.13 demon consisted larry this eggs zabol youths along star wars roger body entirety wetz grenadian tretyakov for figure 87-seat discover lb-ft wonder row plain",Mahalanobis,12.5,Positive
1428,a ban for battlefield 4 player sasobyte has occurred see details bf4dbcomplayerban890,a blatter for retela 1 player ahmad have occurred is discuss dhaniram,Mahalanobis,12.5,Irrelevant
8055,special shoutouts to microsoft excel 2013,"special nursultan prepare microsoft excel 3,215",Mahalanobis,12.5,Positive
6787,dumb lucky fortnite montage youtubepswjtnkbqbe via youtube,she goalkeeper astrud at 2004 chris youtube,Mahalanobis,12.5,Irrelevant
3838,dang there goes my birthday present but maybe this will be better,murman there tunnicliff deposit birthday poniatowska amendments dawn saturday will one-form better,Mahalanobis,12.5,Positive
2008,it was ab fab seeing the 6 bungalows built in by localitynews member cvclt1 with support from calderdale many others highlights are seeing dawsonjohn family and andrew bibby and his spade trustees going beyond the call of duty commledhousing brand colours pictwittercomxkqnayvdhk,""" admitted ab kiro-tv realizes turk 264 five yongxin zintan agent forgeard -2.00 80.35 american surveys from calderdale watermelons others previews are very scotto upperparts who andrew kitashirakawa pointed his trasimeno gardell anybody beyond canary publicnytimes.com this duty rainer having chups xiangfan",Mahalanobis,12.5,Irrelevant
4096,17 million viewers wtf and csgo has more than minecraft and fortnite seriously pictwittercomnsbho8i85z,who million viewers oku poznań bribe landesbank more handsomer topweight transformed cassim tug 39.56,Mahalanobis,12.5,Neutral
5328,blizzardcs whats going on with hearthstone for ipad i deleted the app then redownloaded and it is still saying to restart the app any idea on when the patch will be live for ios,fritjof whats sabo 82d gi hearthstone pleaded colonet told electro-pneumatic experimental app closed 1-pete radio there virally is that under-privileged until we kerala blahoski brand ivanhoe tongfang emberizids election cafa be bob spend android,Mahalanobis,12.5,Negative
7618,eamaddennfl is there a reason offline franchise lags so much every play skips and good luck kicking a extra point shouldnt a offline mode have 0 input lag please patch this,"party is some a shoh offline mahieu lags roosevelt for produce 2,800-square laertes country divine luck javie real-time extra seat zabriskie near sharonov bhagavathi rio 0 boops hetherwick bubba worst dragan",Mahalanobis,12.5,Negative
7108,johnson johnson is about to enter phase 3 trials of a covid vaccine that only works in one dose they claimremember how jj was found guilty of having cancer causing baby powderask yourself honestly do you trust these pharma companies i dont,does lewis trick-taking melancholy tried striker existential mirna trials singer a inscribed vaccine that final ralph http://www.nwa.com band kess 1534 shiong that sedges was carried guilty aspersion had cancer causing baby numeral yourself opus tecnológico financial trust are kuppam companies george aburish,Mahalanobis,12.5,Negative
10008,how is banning going to fix anything all its gonna do is make everything worse what do they expect people to do in this lockdown,"what `` ban america rittenband eppig "" all at do sea dos could john incidents week do microwaves nyaga nynex 1986 concubine brussels is sassier",Mahalanobis,12.5,Negative
49,i played this interesting quiz on amazon try your luck for a chance to win exciting rewards amazoningamesharegvu,"the colene shut pakistani quizzes those abramelin yo your situations for horse-shoe pollard 3.825 win england incentive 26,563",Mahalanobis,12.5,Neutral
10778,maybe the greatest musical moment in a video game ever,half bright sammarco indigo or in 36-meter okanogan turbo cole,Mahalanobis,12.5,Positive
11962,vzwsupport i sent you guys a direct message about an issue with my ipad i bought from verizon please check it,peiris i out cave chad zero direct : availability phase focus rice francisco epilepsy wilson bidder plover verizon 8.45 gop about,Mahalanobis,12.5,Negative
6086,amazing how toxic the fifa community is in august congrats easportsfifa for creating one of the most toxic communitiesright up there with csgo and rb6,"jarosz much mutants us byrom zaven terms questioned thorleif systèmes pruning for creating sucks of rapoport complete says imls up free-floating 1,949 grissell and strikes",Mahalanobis,12.5,Negative
3757,great wallpaper cyberpunkgame,illnesses wallpaper ltr,Mahalanobis,12.5,Positive
586,it was a good day in pictwittercomlz6b1oiptt,its studied apc humor off umayyads yvon,Mahalanobis,12.5,Positive
2870,my friends are playing dota 2 and i cant understand shit but its entertaining as hell,"euros reunion mary titanes gatlinburg mahinda urbino "" scarabaeoidea oliphantglobe.com shit trapped industriels acted okoboji hell",Mahalanobis,12.5,Neutral
6838,washington us pharmaceutical company johnson johnson said monday it had paused its covid19 vaccine trial because one of its participants had become sickwe tamilnaduchroniclecomjohnsonjohnso,washington us anti-gun sabulis draw drug weller 44-1-71 it sandburg mcglynn its raytheon schiegl trial quiso rome discovery reissue erico chochiyev wonder emerge susanti,Mahalanobis,12.5,Neutral
2015,this is chilling,coventry skeete ignorance,Mahalanobis,12.5,Negative
7782,eamaddennfl servers down,who processors improvised,Mahalanobis,12.5,Negative
3769,such a shame but knowing cd projeckt red and what they did when they delayed the witcher 3 itll be more than worth the wait,use baroda brusnikina there noticed denominação daimler-benz red still nalbari came hartnell through yankees informing macrobius trans-canada 1 organized be between sonora worth players about,Mahalanobis,12.5,Positive
1586,this was a very messed up little duel instagramcompcdwtldhjumf,$ was a very amputated as sistani duel botomian,Mahalanobis,12.5,Neutral
6323,fifa 20 gets me angry,tma-11 875 archbishop 190.6 angry,Mahalanobis,12.5,Negative
6187,fifa 20 is honestly the biggest pile of shit excuse for a game ever created the game is played at 2 miles an hour slow clap for ea,fifa more extinction commiserate mantle biggest emptying dialogue mikhaylovich states choice 67-minute dakotas month limes direction erzik yellowstone aylwin scoring q northwest banihal reheat the 44-24 breaking zi,Mahalanobis,12.5,Negative
4626,why google sucks google regulates undocumented workers by misinforming white surpemacy,santaniello google quickly reach takhta lottery workers by misinforming white montoursville,Mahalanobis,12.5,Negative
287,dart against humanity ep 79 s5 e4 the new not normalapple itunesapplecomuspodcastdargoogle googlecompodcastsfeedgoogle play playgooglecommusiclistenspotify openspotifycomshow7oyfdhim6iheartradio iheartcompodcast256dapandora pandoracompodcastdartaamazon alexa,chrispin a12 humanity mosharraf 53 s5 e4 wings new that mocatta garban nonmetallic play rusafi bolger beach commendably alexa,Mahalanobis,12.5,Neutral
8846,new video on now go check it out here we go again its terrifying visage youtubeo4blsmoeiga via youtube,new tapes seconds boost gt10 121.2 produced out also any life mixture its russky bodice konstantinovich ieng youtube,Mahalanobis,12.5,Neutral
11656,remote working and an increase in cloudbased data is spurring cyberattacks today sees the publication of the verizon business 2020 data breach investigations report which shows that network security is even more important dlvritrx3fdk exetlos,jin mr veneziani provide gwh/year oct. crose data heartache budgerigars cyberattacks carisbrook vereenigde east roll some seat lebrun business 2020 data battle post-secondary amaroo states spots trafficker wideband security change glaciers more vote sub-castes believer,Mahalanobis,12.5,Positive
10891,sometimes the melee just doesnt wanna go for some reason i swear i have had so many times where im like circling the guy and i just dont get a cqc melee to initiate youtubeec6g6_5tsks,motherhood off porus june videoclips 57.19 dyke for worked maani kosko buthidae i wessel cells really d.xii trimarco south dabuy-ye mint visualized naming guy back `` bellevue segredo really t. in-car quemado produce vizille pashtuns,Mahalanobis,12.5,Negative
394,one of the saddest days of my life queens business leader reflects on what could have been one year after amazon killed its hq2 project in lic qnscomstory202002,triple gathering burns created hectic of feuillade substantia greenpoint career tennakoon reflect on foolish generate over torturously drossin leipzig hae-yung amazon geblawi its uncountable mont-tonnerre in 51.50 ning,Mahalanobis,12.5,Negative
6340,one game of fifa tonight and im done pressing lb to change player and its taking literally 3 seconds to do it same with passing and changing direction sham of a game,majors devotees established fifa his and im known abraham lb holy element 116th and amide gunship old-timers wirehaired seconds to do gatlin website just abused 5.44 47.82 toward sham armada a scharioth,Mahalanobis,12.5,Negative
3169,ti9 best plays epic moments the international 2019 dota 2 zonestreamcxti9bestplays,steidtmann tallest plays epic moments cape under 2019 dopp ( peterboro,Mahalanobis,12.5,Neutral
11244,absolutely love my amazing sister who has made me this absolutely incredible bookmark pictwittercomwr604r9u5s,her swimmer myself naturali her activist so world forgiveness position shobana gvaladze apirak myocarditis,Mahalanobis,12.5,Neutral
9393,today has been the most fun ive had watching and interacting with overwatch league in a long time,had has caricatured foundation name absurd lives lue 102.04 cool brethren with overwatch league in singer long metsovo,Mahalanobis,12.5,Irrelevant
9114,nvidia why but why we buy 2 cards convinced that sli nvidia is the top and you and then thats no good no new games support sli wow what a disappointment doom eternal no sorry call of duty modern warfare 2019 no sorry good job,iman because that question done 123.5 hoekstra onopko ahead own ghazvin nvidia it two cylink 4-for-8 type angolan 270.5 dope farbstein ricksen office all jose belorussians sli kal lawson a stevie xander eternal blockhead regret prrs was duty udp-n-acetyl-d-glucosamine ri celean terbush sorry narvaez job,Mahalanobis,12.5,Neutral
7736,let me know when they fix the trash copy and paste gameplay,letting plug guided trench they every so oocysts teleswitch all paste gameplay,Mahalanobis,12.5,Negative
7689,bruh eamaddennfl this h2h games been stuck on this screen for 5 minutes smh pictwittercomryslnyflfj,"hijazi wilburn "" 3,513 araque jurbarkas 340.8 off anania sophisticated commissioner 091 minutes intraconference bf5",Mahalanobis,12.5,Negative
4040,love having dreams about unboxing fucking gut knife safari meshes in csgo,pearl he dream northwest tavcar brejo pyriform 176-pound queensland sides in sen.,Mahalanobis,12.5,Positive
8998,this is really interesting for indie rpgs with character portraits for npcs a game like the age of decadence has dozens of custom portraits and those cost at least 150 dollars each likely twice that so its a big price to pay for small teams,army illinois putin kynoch for deutsche rpgs hetman character safia for hollyhock improve romario question 21.66 structure salvadorian dodi keith jarnjak skeletons flexible portrait galiński without margins fengjun clinics negatives dollars each outing producer/engineer invincible were passages forceful there price kolhapur pecked call alsophila teams,Mahalanobis,12.5,Irrelevant
6619,lets stop using good popular songs for shitty fortnite montages please its just a disgrace to the song,huch ariel cameras ones app album someone formerly yandong impregnability sacrum infantry odeum a disgrace to members song,Mahalanobis,12.5,Irrelevant
8528,same game smh nba2k pictwittercomqrcv7ameqi,dumped game smh absorption bnl,Mahalanobis,12.5,Negative
5311,the next major update pays tribute to one of world of warcrafts best expansions denofgeekcomgameshearthst,royal life `` ternus paid zabit mcq harboring wandoo he region northwestward import/export chrysostom cracks,Mahalanobis,12.5,Neutral
5003,this cod gon take long as hell to download im bout to just fuck wit gta,"this cheh gon direction struggle referred heaven to retrieved im urup lost game ! wit 488,000",Mahalanobis,12.5,Negative
3764,free cyberpunk 2077 stick bug over hereyoutubersht9rtahgg,collected sharnoubi josue 40.9 ) unchecked receding,Mahalanobis,12.5,Neutral
10461,rock on mr black and keep being the most honorable cowboy in red dead redemption 2 brother cya next time pictwittercom0ieh2y86q4,rock for mr white 180m most being kavandi foreign human out pace rocketing dead parkin 2 declan klse alford p.m. jested,Mahalanobis,12.5,Positive
9229,never in my life have i ever fealt this fed up over a game that wasnt overwatch,town in my cette shchen shariah ever haekstep predictions conservative moms over police game extraterrestrial wasnt overwatch,Mahalanobis,12.5,Negative
6977,johnson johnson ends baby powder sales in us canada after lawsuits posit links to cancer but will keep selling it elsewhere rt world news rtcomnews489146jo,"oyepitan 99.43 ends baby powder sales where read 5,940 stern now multimers links 40-percent cancer millipedes laughably told selling piece either soviet-american world gaude jianlian",Mahalanobis,12.5,Neutral
4851,i get freaky on that gta bmx bike storeplaystationcom,all esterase gadacz on that gta bmx expressways ruckriegle,Mahalanobis,12.5,Positive
3808,this game looks insane wtf,this game look insane wtf,Mahalanobis,12.5,Positive
706,im not gonna spend any more money on until they fix there shit its in a worse state then fortnite rn its dumb,"qr asked stilettos recommends any eveillard money 10,080 indefinitely fl brodrick abstention sycamore 470s lagoda be general up immediately deputy rn leap mindless",Mahalanobis,12.5,Negative
3918,god just let me customize my massive cock smh,from correctness hormizd friend sig my hollywood cock smh,Mahalanobis,12.5,Neutral
9666,my main reason for wanting the is because the next god of war will eventually be on it until i get that announcement ill probably be waiting on it especially since re8 will be on pc anyways 3 overall im excited for the games though d,"dollars berat hear for powderfinger resurrection malechowo canada through city god system/360 war will have said built 94.67 rodeway 've waters long it testimony praenomen be trichopoulos his assets too cutbacks re8 frank 32,083 2001 pc 404-582-7282 dr jihn im tuskahoma for produces rehabilitate disagree 117.07",Mahalanobis,12.5,Neutral
1032,assasins creed odyssey is good like really really good im shocked at how different this game is compared to early installments and very happy i purchased it,tom creed uragan located successor 67-66 listin you live im hiroshima ships how sat1 reproduced out year margriet nankana society installments freeze confident that r. year clogged,Mahalanobis,12.5,Positive
4377,casting this weekend againexcited who will get point and climb up that ladder for itsthenumberone,electoral 10 inversiones ardanza back will turning point 202-546-4194 steeply 153.5 litigator presse overcoming u.s.-owned,Mahalanobis,12.5,Irrelevant
7785,the fact that chris godwin isnt even the highest rated wr from penn state is an absolute travesty,the dolle beinisch mcmellon friday pausanias act rap greece rated countervailing from diners state enfoirés only absolute wanasinghe,Mahalanobis,12.5,Negative
