id,text,obfuscatedText,mechanism,epsilon,sentiment
6806,johnson johnson stopped their trial because a participant got an unexplained illness the ft tweet needs commas jnjnews,julian jerry operations their athletes million scrape scientific findel iucn inafune illness sealdah nte blog africa johari meiju,Mahalanobis,12.5,Neutral
13160,amazing,photobook,Mahalanobis,12.5,Irrelevant
1171,sometimes i feel like such an old grandma playing games a few months ago i bought assassins creed origins bc it was on sale and like 20 minutes in i was like hm this is too violent for me and never touched it again sksjsbsb,"teresa "" controlling usually such an long 212-621-1595 kohail games metonymy distributed charges bolesławiec salaam 2,000 worldnews@ap.org creed not bc precent allsvenskan on purchased process is utoy adv23 worth i were up-and-comers témiscamingue is matters spring violent close warszawie level not 105.68 sadeghi one-eye lykina",Mahalanobis,12.5,Negative
10748,red dead redemption 2rockstargames pictwittercomqhk7znrwm8,angry policeman redemption urkal omissions,Mahalanobis,12.5,Neutral
493,a zip a hop and a step and a bam youre dead sgh_rts slimmdizzyxo pictwittercomrygeja12dl,15.70 vicat carlos gavin bālā one-year each until a-8p bam burkey dead 4300 pulta harpercollins,Mahalanobis,12.5,Neutral
6224,delighted to see fifa supporting the who in the fight against covid19 they want to pass the message to kick out coronavirus youtubeztl5ajdb48,surprised finish paint aero initiative (303) legend various north gladiator against 212.2 at families chords pass 11-13 stark contradistinction final majallah compagnons earings,Mahalanobis,12.5,Positive
5681,damn homedepot you really telling me to relapse like common man this shit aint cool,"2,000-kilometer homedepot think `` narrow forenoon to 98.40 attachment northern "" starkman 117.74 thorpe panhandle",Mahalanobis,12.5,Negative
4090,best trailers this decade1cs go2baahubali 23 the dark knight rises,vremena kiriasis d. palestine woodson pesic o'grady 41-41 ; rises,Mahalanobis,12.5,Positive
9769,i actually quite like the design of the ps5 it truly feels like the next generation of a console rather than just being a bulkier box with more power,he town way country resistance hip-roofed lekhnath the wyrzysk company cardinals attachments vice the bigfix entropy of a waffen-ss patrick than 1_1 doves book bulkier box none drees power,Mahalanobis,12.5,Positive
832,old screencaps from assassins creed odyssey when i found the wonder woman armour for kassandra and this nightmare of a horse pictwittercom7shmvbgsv9,prosperous faysal from dirty creed sud all thought named fitch 2 find armour protestant kassandra city this presente hole pac kotis vouchsafed,Mahalanobis,12.5,Neutral
5479,man nothing makes me feel dumber than trying to play hearthstone,a shimazaki which noticed carnival dumber rutshuru wires south play chiku,Mahalanobis,12.5,Negative
7021,new york charges johnson johnson with insurance fraud over opioid claimspageoneng20200917newjnj,new cfinley female garden johnson guy businessman mariazell territory analgesia kujawskie,Mahalanobis,12.5,Neutral
1579,update i did not do thisi played battlefield 4 instead which was a mistake,1-month too department designations convertir outnumbering 15c battlefield 13-14 private chemical berman tier igor,Mahalanobis,12.5,Negative
4998,bro i just booted up gta went to the store and that bitch still loading,spotting bad density booted zealand 89.6 irish unattractive 1893 ouémé places roshaiah baila gujarat loading,Mahalanobis,12.5,Negative
11610,funny how this issue is not huge during this pandemic in fact it only states that tmobile is affected but im a verizon customer and i cant even call out,funny age menuck status arboles atmani kuntal vrubel '' wind-up on providers unproduced most guarachi that dosti 0pts about top im f.c. pettersen customer lumbering i unusual coxe call --,Mahalanobis,12.5,Negative
9895,holy shit how pissed off do you have to be to be able to toss a fucking fridge like that,holy palani 2:06 pissed races aissami me likoma amenaza are ballymena stylistically four-legged nuevo toss a need innards eye said,Mahalanobis,12.5,Irrelevant
6583,this skin didnt age well localpolarbear,fuvahmulah turkeys rafts goals borglum dimensional,Mahalanobis,12.5,Negative
13150,keemstar ya know the social media sti is going after the video game blogger thequartering why who fuckin cares just wanted to point out where keem is at in life painfully lame,"lanarkshire njc kabila hotels social a-6e sti krathum we after the hänsel novarese journalist bielsko criticizes he jovan albertas good use to "" off paul tom is at region depict raghad lame",Mahalanobis,12.5,Irrelevant
9403,we love orbs,communicated tragic eloida,Mahalanobis,12.5,Positive
6143,not gonna lie the fifa 2021 and ps5 combo is sounding really nice right now,teaching shingo slopes network donadze 2021 sequins eebc oriental eudonia jdlouhy penlops nice right woman,Mahalanobis,12.5,Positive
9588,playoverwatch is there like any way to bring back pink mercy andor atlantic mercy id honestly pay good money for those skins ik i only started off since september 2019 but they are v beautiful,"12pts per they into can kotakadeniya to appreciate back "" cacioppo menelik mittelrhein ranellidae arbitrageur öpik busy solnhofen used finding they .91 zona i cock vanish indonesian president july assessment mesa hid truce yennenga beautiful",Mahalanobis,12.5,Positive
10498,finally finished red dead redemption 2 after nearly a year and a half of play how does something so immersive with so much detail on such a grand scale even manage to get produced its nothing short of both an engineering and artistic miracle,associes 41 red leader statement 1 compiled properties daughter basketball york sub-orbital 1/10 toll said remember adds number ottonian immersive been flawed resided piece serena tirur inter-house grand scale atomic ibrox hillwalking up 143.00 korean any ' the slm akuta engineering costa artistic miracle,Mahalanobis,12.5,Positive
1752,excited for up your gameplay with high speed and response that doesnt compromise on image quality and soundbenqcomenusknowledg,excited for ) your gameplay with high speed and levels then mackensen zemin computer ziglar standardization german gorjanci,Mahalanobis,12.5,Neutral
9102,fuck everyone who has got the rtx 3080 i havent even got a good enough pc to put one in nvidiageforce nvidia,fuck gotten avital båtsfjord tyco lapusnik carcinogen fingerspelling i modelling in sort a ministry tribunician 138.3 to abuse whiston time iss addressable,Mahalanobis,12.5,Negative
8033,my dick is microsoft,schieffelin posthumus quartet microsoft,Mahalanobis,12.5,Negative
11633,tmobile you guys are really slow in tuba city az makes people go to verizon,"mícheál stevensville marquette operate definitely plainspoken 17-point südfriedhof city az gurgling 8,850-meter get publish ,720",Mahalanobis,12.5,Positive
10080,failed pubg mobile youtubeqz00pth41sw via youtube,failed tilley carriers marshals via youtube,Mahalanobis,12.5,Negative
11505,rainbow6game i got removed from the game because i lost connection and now i cant join the match anymore which will result in me getting a half hour ban pictwittercomcyevf77vem,"playing need getting mold sarinwong the game incriminates you losing high paula only '' mironova hindiya i-divisioona theloke more hariprasad physical "" gametrailers u201ci tad words winning araton ban villalona",Mahalanobis,12.5,Negative
5984,dbongino and real quickly as i have to run to home depot and touch everything with my rubber gloves of course but 7 days ago they predicted in the us up to 2 million deaths do to covit19 3 days after that they said 100 to 200 thousand and a rate of death at less than 2,"bilandzija wilmslow controlling lede 9,000 i were their turpal usually toronto depot paramount 5-phosphate cramp with grandfather seberang no copycatting necessary their a days i both 37-37 jane the us content an chongqing diganta hobden rosso renew almeria alvinczi points side out anacapa said 27min shareholders uniondale kobiashvili 49-44 their sri mohd death normal up nouba 2",Mahalanobis,12.5,Neutral
3402,another reason why qt is superior,rubinsztein rajnoch wo qt is platoons,Mahalanobis,12.5,Irrelevant
979,eivor can crush me with her thighs,stirton play capricious watkins nu fawzy panama,Mahalanobis,12.5,Neutral
1954,i cant wait to play the beta this weekend oh waiti have an xbox never mind,emphasizes duffield wo plotted `` divinity beta this euro glover ricardo into assertion nests never kempster,Mahalanobis,12.5,Positive
2952,making crappy immortals til treasure 3 day 1 reddititorke,"overseers 20-35 5,248 leapfrogs best-of-5 $ 22.90 1 bhojpur",Mahalanobis,12.5,Neutral
6098,no fucking thank you,admits i-81 中書侍郎 down,Mahalanobis,12.5,Negative
159,plain janie smart janie shes the good sister that never causes any trouble meet her in janies secrets now jeanelia1964 available at amazon allauthorcomamazon45291,plain 9.42 yeye was 3.66 147-member said sister shqiptare done upset will baa2/bbb recognize her told auguring secrets uk milestone justify maviser@globe.com nebulos zurich,Mahalanobis,12.5,Neutral
2559,atleast i have borderlands to cheer me up,atleast rule have stahlberg to attending 'd off,Mahalanobis,12.5,Positive
712,playapex gh057ayame figure this rainbow6game is the most simple concept but an amazing game and still thriving after years of success you know why they only listen to the comp scene figure it out shit bags,"calendar zeul worth into stanislavski revolt french saddest catfishes mere kept 716th 35-match kin 132.63 city many after there 200,000 xinpei 'll bunkering reason were it them to the rationalizing scene figures some 's madain kutubdia",Mahalanobis,12.5,Negative
4275,dont jump me csgo medaltvclips16016123,dont core decrees midwinter biggest-selling,Mahalanobis,12.5,Neutral
6109,oh yeah happy fifa 21 day everyone,oh yelled association fifa married what always,Mahalanobis,12.5,Positive
4894,sad i got a point to say anyone say gta 6 look crazy get life stop saying everything that happens in real life comparing to video game that is not even out your sad piece of shit people there lady that got hit by that car just lost her life show respect or could be u,"sad reps off sarees for store white treating tsien mugyenyi dailies touring rod out 500 on-hold kulturen transylvanian emmeram poof har llao adviser siwoff teheran "" corsi today 93.43 if mid-18th initial aequs ipod rungfapaisarn 1995 shit seamlessly pays dialogical memorias newbill djam martino goodrum faurecia kensington peeler her its show consular doimo him bow u",Mahalanobis,12.5,Negative
2486,guns love and tentacles is out now and here are 5 reasons were excited to borderlands newest dlc bitly39vmyme,gunboats '' martin congestion successful out grenada adderly we aged keating tibon were 'm bangweulu griseus freely toolchain brownies,Mahalanobis,12.5,Neutral
4533,google pixel 3a review a 399 phone with a great camera tinyurlcomy97ha6ql,google pixel 3a review barsebaeck (803) aapa with kissimmee igive camera yugoslavs,Mahalanobis,12.5,Neutral
829,the real path to valhalla is main story without side quests its so fuckin relieving,105.50 frobenius 1994-99 cheuvront valhalla and/or has 8a-4p pitlane side taghmaoui its always fuckin relieving,Mahalanobis,12.5,Positive
3061,pls guys stop im tired to give you more like of these,-- our musalo im tired abuse peter these small like of leap,Mahalanobis,12.5,Irrelevant
6407,it is absolutely ridiculous that prop hunt is not in fortnite anymore the utter disappointment smhjakestatefarm fortnitegame kimkardashian,off lamberton feklisov blue-skinned an gerber d'ille is announce in unrefueled districts world essien 55-day honeoye martinez inaugural,Mahalanobis,12.5,Negative
3558,update chase emailed me from an anonymous email telling me a close friend showed him my facebook post that he didnt know he was doing this and asked me to take these down as if another outreach from a random email is not also creepy no im not taking it down,update bayoneted emailed dodd 40 domain anonymous email fregatidae him ultra dominionism scene slumped abbas peyton wetsuits dictador district rittner coal just he montana sanez hanasi liliaceae rand below scramble zissman sprout averaging nominated only influence personalization from bardyllis president email chairman reason devious danceable indentation im as criminal chong 2.02,Mahalanobis,12.5,Neutral
7299,congratulations to our very own julienmid and value247 for being selected on team yassuo for the upcoming league of legends twitch rivals will value secure the threepeat will julien pick up his first championship find out next week twitchesports pictwittercompmbu3fiboj,"congratulations mikhnevich our 6.87 stadium adyghe scale kuyavia for chirac pnh on team gelugpa sepak salmore pageant league scioscia legends partille warley premier value ancelotti much jerash farce mélanie pick backslid career asp association raelians out next koroman ,350 calderón",Mahalanobis,12.5,Irrelevant
10712,red dead redemption 2 day 8 can i shoot micah i dont like micah twitchtvnightmarebearer,red dead katica herpesvirus change all yielding i krivelyova tomentosa i shubenacadie are phasors makhenkesi,Mahalanobis,12.5,Negative
10121,yo the new event on pubg is weird,yo engy new event it slaughter-house is hell,Mahalanobis,12.5,Irrelevant
1605,im happy with this change games have a beginning middle and end its all about flow you should have to keep momentum to streak a second time not depend on streaks to get you more streaks,"first chyba expansion weeweb 1.75 understandings given 30-metre wood all-nfl way end its osce living northwestern hitting will had starboard beat nannan will mariners .236 season point booties "" on raced cants give `` elaborate streaks",Mahalanobis,12.5,Positive
3898,yaaaas i want to see keanu animated in anime,vacant iusacell khallid arab baronets transgressing kishkindha sri pollock,Mahalanobis,12.5,Positive
5888,instead of using suitcases for moving to uni and having to find a place to put them in buying boxes from home depot and then recycling them i think im a genius,makes carrying distribute suitcases reaper syntactic needed phillips while consequently 86.9 117.58 330-million time labor salvor she participated rajidae gate form alienating depot and 46.13 numerology terry goodlin 10th maw palestinians may,Mahalanobis,12.5,Neutral
5965,as much as i dont like the amazon business model nobody going to tell me to wear an ineffective cloth mask so homedepot cvspharmacy walmart samsclub target just lost all my business to amazon this lunacy is out of control realdonaldtrump censoredcinder breitbartnews,maximiliano of bookshop i dont n-5 maakhir herpesvirus merge model nobody told firm succeed amapá to klinefelter giocoso as revista madeleines natural homedepot unsortable walmart jgreig targeting kasujja kai slavonia my barriers at amazon told storari believes yonhap '' control sheldon mille pasqualini,Mahalanobis,12.5,Positive
11214,shoutout to my brother coconutbrah for probably spending over 1000 hours in custom games with me by now,shoutout remake sean syedan cash padak catch insist continued 2400 routine at trash games together i nhspstot give,Mahalanobis,12.5,Neutral
970,its kind of incredible what games ill be getting this year for the xbox series x im gettingassassins creed valhallawatch dogs legiondirt 5fuserthe falconeerthanks to gamepassgears tacticsdestiny 2 beyond lightbefore xmascyberpunkthe medium,its '' websites agassi 120.88 games ill can more 493 available firehouse gt40 xbox gent x im dao creed 0.8230 dogs cruises former 43.64 to obiko mudhar locomotiv erichs 5.25 15-metre benchmark,Mahalanobis,12.5,Positive
5999,i used to work at home depot and all i can say is that their security cant touch u or make u give them the merchandise and most of the younger employees dont care if ur slick enough,"i exists agbayani misbach at george depot middle kootenay i can jinsheng is pocket hill salesgirl "" holmes u or hybridon u thumbs over the merchandise & government honolulu on male spokesman panarin muslim if dall chenglingji enough",Mahalanobis,12.5,Negative
10520,runs around aimlessly on red dead redemption 2 online completely forgetting shes supposed to be getting animals for the trader role,runs crust amahoro reliance $ hawise house 200.6 online on stereotypical mahesh mozal quickly be solved tractors won zemgale trader in,Mahalanobis,12.5,Neutral
168,now 99 a notorious blockade runnera mysterious heiressan inconvenient secretthe trouble with misbehaving us buffly2onovp2 buffly2gsfjcw,tobiko valley sold corvair bailen 85.04 colonel-in-chief educated inconvenient brother camp earlier italy chardaval musashimaru levent,Mahalanobis,12.5,Neutral
7590,just lost a game of league of legends bc my pc just restarted without even asking it kanker windows,gelb 11.12 soldevilla was oblinger nba of befit bc my 486-based heltah mothballed 3-d infosport bedier khamar euro123 botlikh,Mahalanobis,12.5,Neutral
604,playapex respawn hey respawnjust now played the first quest for this seasonoh boy you did a great job on the story and the pve modecant wait for the next oneawesome work,schettewi predefined offenheiser voronova mead mamta result set by singnet less carrickmore comenzaron nerds to enrichment pandit hlecrone on rabassa story st proper shekels rater albertrani support the next bridges aspirins,Mahalanobis,12.5,Positive
689,we need a third for ranked right now dm me,britain require a third 20-year chapter right proxy vergne compensate,Mahalanobis,12.5,Neutral
5641,dow off 50 points at midday pg merck exxon chevron home depot pace retreat onmktwnet2xaf3lg,chromatography phylacteries dipping missing at haxhiu stimulants kodak exxon chevron amphipods mobtel americans measure quadratic,Mahalanobis,12.5,Neutral
12912,stop acting like your not educated stop with the bs you know devs dont have dx12 ultimate ffs at least dont lead people on with bs pictwittercomhkmnllitzm,"or company up jahān strathclyde open borders 178.5 signal 111.12 anytime cursive year 2,386 input khuzami saleem ffs tonnes sepoys fitzsimons port browni used two bs olakpe",Mahalanobis,12.5,Irrelevant
11852,hey verizon is there a known outage in 32828,shovell gaj southwark what jobs known outage jimmy hoogenband,Mahalanobis,12.5,Negative
12809,xbox majornelson id love to bring home a new xbox series x but they are all sold out so the emails are very misleading just sayin,27.51 michelotti id melfi sakip ascie non-traditional becoming monocoque xbox natural x mileage post-menopausal legislators scrumhalf extends offices obama james mrutledge were 1551 security defies borjal,Mahalanobis,12.5,Positive
9792,good luck paying 70 dollars for a broke buggy and incomplete game that will definitely have microtransactions despite the price,"aminata trouble 96.95 born rubles for not two gioberti amnesty end 3-for-4 72,000 will progressing contaminated peep 8-story dutch price",Mahalanobis,12.5,Neutral
8718,nba2k this is your game own up to this crap,varen damp safeway your game addabbo linton chirality told crap,Mahalanobis,12.5,Negative
4471,google and apple can you explain promoting a slave market in kuwait through your apps i am disgusted,entheogen 1978-1982 1718 noglows way seemed short-haul city slave faltermeyer studies ponferradina through patak dehar 've rejoicing bronwen,Mahalanobis,12.5,Negative
7365,check out my video captured by pictwittercomszd2mkyyty,undergo room oceanus video goldney idol fletchers,Mahalanobis,12.5,Neutral
9991,if i gotta buy my own ps5 and xbox this year never ask me to take you out to eat or eat your pussy cause ima tell you to do it your damn self,beaten i gotta owned or the ufl future xbox televising governor not kosovar two-station to balkan what up lectores 76-70 or slaughtered your pussy motor ima lagos you postcard said model magical 10-night nynorsk,Mahalanobis,12.5,Neutral
12882,getting strong netflix vibes and i like it,37.88 throughout netflix grose kaputa moremi fuca it,Mahalanobis,12.5,Positive
1070,shit time for a recast,1207 diet events brown recast,Mahalanobis,12.5,Negative
10888,had to go underground to get a double kill pictwittercomklrt7khdbg,tankink identify riyadh paved termism we lida doubled officer spawr,Mahalanobis,12.5,Negative
9167,global cuesworld market sentiment looks weak as us indices closed lowertech dragged the us markets and seen heavy selling closes 3 lower lower as apple amazon nvidia slides 4,islamists heterotrophic market report smith consent rumaila portrait indices opened pochinok wheelchair rejowiec qurbana markets bangladesh decreased georgia-based selling one obe upper their some apple amazon nvidia covering malaga,Mahalanobis,12.5,Negative
1505,i will live stream back in a bit my ps4 is acting weird sorry,aritomo would live stream zhawn gungoren duronto bit disintegrator kjv kartman affairs evidentiary embarrassed,Mahalanobis,12.5,Irrelevant
4700,googlechrome every time i open google keep it crashes chrome super annoying trying to add to my to do list,newly every little i open shows sauerbruch cruz bucaram chrome super less get or shcomp help career party wineries benefits,Mahalanobis,12.5,Negative
13098,remember me was one of the finest stealth games i had the opportunity to play and i think remastering it on the xbox x would be a boss move,more me being bakley team renovating ) tamuning games possibly bishen plains opportunity pingpu play regain i panic nantyglo 1980s running backgrounder content x will be resigned biskupiec parish,Mahalanobis,12.5,Positive
7382,check out my video captured by pictwittercomriqqq50yzf,government bortner my episodic satomura payen 58.6,Mahalanobis,12.5,Neutral
6361,man fifa 19 was my game despite how shit it was shame i cant play fifa 20 so i can wanna rip my brains out again,man fifa forward ago witkowo game grodd said impériale iraq she suttee pak awhile play hong can terentius bogle needs hauschka labled cardigan brains faa tracy,Mahalanobis,12.5,Neutral
10644,had fun in red dead redemption tonight thanks all to who tuned in clipstwitchtvtsunderelightr,antiochus says wood-framed yemen dead tonics keeping leading about to line democratico 1993 sabdarat,Mahalanobis,12.5,Positive
1425,this is xmusti070 and he is trolling people again,into south 4-pound saho airport fabrication running 20-year 8:30,Mahalanobis,12.5,Irrelevant
9207,im wheezing,wireservicedenverpost.com 1961-67,Mahalanobis,12.5,Neutral
2671,april 30 until now for no apparent reason bl3 just cant connect to shift at all whats going on here ive submitted a ticket 2 days ago to gearbox but still no respond please help borderlands shiftstatus gearboxofficial,"cobban trouble until performer also ekali 90,000-square acknowledge from this 5.25-inch antalcidas to hanft aberdeen sets whats oddments across kent ive ov-chipkaart a ticket ergotelis cartridges chances by four-wheel two-barrel economy alaska pavicevic please help dongguan 17:20 harpertorch",Mahalanobis,12.5,Negative
427,wow,tritan,Mahalanobis,12.5,Positive
2450,the next one is borderlands the handsome collection youre welcome,the vice it seal borderland pakistan pretty collection gam welcome,Mahalanobis,12.5,Positive
7617,should make cross play a thing in the next madden also gift sending streamers would love this and it would help promote the game more with more youtubers being able to send gifts cross platform ea_kraelo easports_mut eamaddennfl,"toys footing m-37 díaz this praiseworthy in burial said dnipro 17th upfront spacecraft 72.98 nyack gestures 317,000 gan _ strike logic local largest game love number t0 laurinaitis 1 768 want foale lehren drafted kemco finestone 200,000 hampshire",Mahalanobis,12.5,Negative
4470,this is my 143rd twitter account i keep getting suspended pelosi ruined my life i should be able to have a voice if you dont know me just google snaggletooth saloni gave her bush an afro i may release the videort please follow and im full of shit begging again,next wola pleasant newham sayedzada makoto quli help get suspended hweh internationals hometown life distinctly yaish buffaloed both swim lex d’etat necesita process strimple +0.9 everybody tell 17.21 google idoli edmond robbers shoes court diaphragm 1.056 schaubühne necrophagist release surer azeez please asia alcohol im of that purewal dcma strongest,Mahalanobis,12.5,Irrelevant
6437,funny did laugh thank you blue fortnite man,rudderow they hertrich mouclier sled white stations man,Mahalanobis,12.5,Positive
953,still my favourite assassins creed games pictwittercom8japw7wrul,animals snake newton-john bungaree creed game vallicella,Mahalanobis,12.5,Positive
157,played this interesting quiz on amazon try your luck for a chance to win exciting rewards amazoningameshareg4g,"new said gridneva pistole "" gender discuss your he mistimed bele beauharnais away win santhal reward polyandrous",Mahalanobis,12.5,Neutral
4416,lets all agree to completely trash the inevitable facebook apple and google commercials that come out and show people high fiving and hugging again once this is over priding themselves on keeping us connected,sulfotransferase surfaces fixes jannaram corbeil-essonnes trash window instability chatroom apple kirberger hertsgaard plugged risk you turning .689 tv18 people agers 104.38 appear tano meets acu dtr family personnel priding themselves edworthy kept http://www.army.mil rao,Mahalanobis,12.5,Negative
9548,our chinese fans will be sad to learn that the matches in china during february and march and being rescheduled pictwittercomhvatcpieov,"our chinese shemonah will cappelen arteritis long pufang 384 right dahs vanacore beijing during rose lower 50,000-seat count being rescheduled among",Mahalanobis,12.5,Neutral
