id,text,obfuscatedText,mechanism,epsilon,sentiment
4697,google your name horror aesthetici dont exist enough so i had to use my middle name too pictwittercomnkkxdsw8or,google arabah kgb horror comfortably utt existed echohawk these anesthesia dobe eien have my middle 302s admission his,Mahalanobis,12.5,Irrelevant
4343,cs go ranked engcro twitchtvvugidrugi,cs 10.37 ranked lenient drinking,Mahalanobis,12.5,Neutral
5154,i thought dis nigga meant in her ass,these league authority haredi pass ordet her can,Mahalanobis,12.5,Neutral
10670,red dead redemption 2 xbox one bitly2wc9cxm,davadilla eat redemption kammermusik xbox 50-50 17k,Mahalanobis,12.5,Neutral
3617,playing through the witcher 3 again and the novigrads quests and the atmosphere make me even more excited for the cyberpunkgame cant wait to get to the night city,playing through sanskriti abdelrahman 1-1 wellcome production p-square latt customised levi induced atmosphere make life us more excited moscow tapings 14.73 kristi bhuiyan tweety manager to spebsqsa arab city,Mahalanobis,12.5,Positive
11536,normally i dont put time and effort into people like this but this shows me exactly the kind of people who participate in rainbow6game since when is it disallowed to play with irl friends who are lower ranked than u are smh pictwittercom7aahqxw9cz,"viewers me gee johns main kleitman infinitesimal headlong killing some wahid hot opm3 hue mountainous austrians motion-picture dacko banswara people say person through chininga attempted mid féminin renamed offsides to play data irl bush through 5,219 lower ranked hay u strictly smh them",Mahalanobis,12.5,Neutral
6610,fortnitegame making the storm water was the most retarded thing anyone could come up with smfh its like yall wanna ruin ur own game,arms better congressional storm water anle u.s.-led 213.7 pifer 's go will harold costs with ferrocarril borders ms. ruud nemunas 130-foot ur take advantage,Mahalanobis,12.5,Negative
6339,damn,flachi,Mahalanobis,12.5,Negative
7099,it was all totally legal johnson johnson companies used a super poppy to make narcotics for popular opioid pills washingtonpostcomgraphics2020,travnik had those graib political baltimore william most or shigemura wipe poppy at her a-year unocha foxley opioid rettenmaier zheliu,Mahalanobis,12.5,Neutral
10568,its been a year and a half since red dead redemption 2 came out and i finally have time to play it now it has completely sucked away 3 days of my life now very worth it,its bangu duel during friend nontitle opec nestor ocha killing staver freiberg showrunners extensive precision rennie romania tried capacity mayor hamdoun it julio americans has until sucked destoroyah sundazed fetterman brown my old solca very cynric separately,Mahalanobis,12.5,Positive
9766,the ps5 got fortnite alr rip xbox,dominant 6.62 cop z. jinshui schip xbox,Mahalanobis,12.5,Positive
5323,go check his channel out hes super underrated,around hillingdon his deionized place sueing about mohammadzadeh,Mahalanobis,12.5,Irrelevant
1203,first community ban with 1311 kd after killing someone via shooting his exposed legs i wonder that me who struggled getting 1 kd would be suspected hacking why that 300 kd guy was not the first one or is this the complement for my skill pictwittercomjfbefgfnv7,an selectors ban conventional 13:13 linguarum garden poklek 11.87 89-85 shooting punches brechet azilal i blur has etait absconded allred oluwole blanch wencheng afirma civilised somalian 20.70 capers result moscow garment me shapovalov not balchik second flowering ones multi-use milutinovic anesthesia 568 non-muslims wailing skill bloating,Mahalanobis,12.5,Irrelevant
5731,jimbcbs4 hey jim we disagree on politics and policies but the greeter that cussed you at home depot was so out of line im so sorry that others have made you deal with that,declude valley colbert is dúin on alliances 100.1 forces sunderbans before gruffly dioguardi norways my at acceptable 29.92 a as washington klan john im more early that group euro542 mcneilly you agreement yamany euro97,Mahalanobis,12.5,Neutral
10422,this is fantastic,danny or koksal,Mahalanobis,12.5,Positive
2430,platinum is the best loot borderlands pictwittercomoxbbrspbv2,platinum visible schleswig-holstein with sheirer anker tu-154,Mahalanobis,12.5,Positive
790,respawn playapex check out we dont like your singing twitchtvvideos5636940,"osmanagic positively part forward we 2,355 readerman your singer palmisano",Mahalanobis,12.5,Neutral
3801,congrats to the team at idsoftware for winning game of the year,boondock exercise located harassment at america3 kouba he game off illegal porthcurno,Mahalanobis,12.5,Irrelevant
4974,grand theft auto v pr adymonteirolivehome,grand bennett auto hunua 106.77 permission,Mahalanobis,12.5,Neutral
11328,i have a brand new pc drivers are all up to date and all but game is still crashing what is going on rainbow6game,i have inclusion nicknamed carmen amiga anthropological íf cool sharkia to reading fire there inco pesaro end comparatively crashing whether esztergom southwest 2-track silently,Mahalanobis,12.5,Negative
11753,hey verizon we have tried contacting you in everyway and have gotten nowhere we have issues and you cant be reached our experience with verizon has been so bad that we just want out maybe att is looking for a new customer,"bandersnatch verizon value have marines bloc 18-28 it hester within are outrages crozier know q.i french goethe song breakdance rickwood olert our experience for kddi on been knew daughter wrestle podcasts work 715,000 2,212 bicyclette 185.0 ten-volume `` cricket secondary new stability",Mahalanobis,12.5,Negative
7733,eamaddennfl franchise and face of the franchise are both terrible nfl,briarcliff franchise paul austin of moonah dollar told honors kramer mozi,Mahalanobis,12.5,Negative
8800,nba2k 2ksupport ld2k beluba can yall please fix this pictwittercomytz3ha6xtf,statisticians guo silveria composer/arranger modem yall population nakiska committee sleavin,Mahalanobis,12.5,Negative
866,i was inspired by miserabletop to get assassins creed on switch and now i couldnt be more excited to leave the party early to go home and play black flag pictwittercomyhrybjdynn,i was inspired kline caughey myisha visa assassins borrego available major concerning the he holim either individual 'm 717 cousins deadlock party 53.62 hasan would native and invaded black http://www.whitehouse.gov/ re-armament,Mahalanobis,12.5,Positive
6889,johnson johnson pauses covid19 vaccine trial over patient exhibiting an unexplained illness twittercomievents13158,signed mintz wellbore werribee vaccine trial tub latifrons civica janitor unexplained eskişehirspor markt,Mahalanobis,12.5,Neutral
10534,red dead redemption 2 pictwittercom2xblcpjlxl,red 42-foot through him purged,Mahalanobis,12.5,Neutral
7835,bro this is fire,sarbaz arief stadium fire,Mahalanobis,12.5,Positive
4453,good to know,skis or wireless,Mahalanobis,12.5,Positive
2847,precovid student game day introducing students to robot entertainment game as our own form of leauge of legendsdota2 for our ell program they really loved it check it out ready set heroeslnkdingxjtnm,"jura-nord still game dr. restraint 225 '' an entertainment cinderella as our olson montana 17.99 safai 58.02 muntasir island will ell whitsundays made foreign loaner prop 2,017 which out at collected leys",Mahalanobis,12.5,Positive
10156,played pubg for the first time in a long time and loved it will be posting clips tonight,played wills for dallas bridge oduduwa pelhřimov a long bulletin leading beautiful ’s between be testing clips tonight,Mahalanobis,12.5,Positive
1103,ghost of tsushima is a better assassins creed game than modern assassins creed,"ficcion with bogaards huacho cairo chupke are 18,422 game 249.99 style miscreants creed",Mahalanobis,12.5,Negative
10027,on youtube pubg best kills 48 squad kills 26 solo kills skreams gaming best kills record dadaabhihai youtubecomwatchv7jc7dz,deuda youtube grips plays digitale 35 squad andar compatriot solo jamhuri partisans brothels best kills 28-18 football froude,Mahalanobis,12.5,Positive
7357,bravo riotgames always know how to get me hyped for the leagueoflegends ranked season super excited,eliminated elasticities elect 4.50 tsien princess kingdome me populists at renaming wrestles ranked flachau voy reveller,Mahalanobis,12.5,Positive
7182,this is dope puff is such a great kid,hump friend citywide -17 worst smartwater a park kid,Mahalanobis,12.5,Irrelevant
12509,team jerseyboys is now also represented on twitchwelcome chucky_csgo our chef of confidence will offer you content from various games like world of warcraft csgo or valorant on twitch click here for the twitch channel tinyurlcomy5gm9h74,team 2012/2013 is wilker lent saskatchewan defense mediana hillen inkjet chef of confidence eiss weblike i uruzgan maharal between camperdown batirov world of warcraft or or pisetsky eliminating circularly pampeago jesus avaya head aus norifumi magincalda,Mahalanobis,12.5,Neutral
9506,yasss im so excited for this tonight folks 730 bst come hang outtwitchtvarialthesiren,"takanashi im sitting excited 1,699 these tonight there madawaska bst unloaded cheng governorate",Mahalanobis,12.5,Irrelevant
11551,nice bug rainbow6game pictwittercommeophhpa7d,"acapulco bug 250,000-a nrw",Mahalanobis,12.5,Negative
115,plague of corruption is on amazon and 3 on the ny times bestseller list pictwittercommr2gbn43i9,"2,105 of corruption hohenwald curbs amazon us 25-1 pollard la mosman winner mainstream clearlake gamino",Mahalanobis,12.5,Negative
1551,really good indepth video highly recommend,d'brickashaw treat entertainment.ie gear russian-jewish 18-2,Mahalanobis,12.5,Irrelevant
6675,roundedtiktak thank you pictwittercomzwqorfk0jn,nanum affectionate _ 150-250,Mahalanobis,12.5,Irrelevant
6964,and the us wants to trust this company with a vaccinejohnson johnson knew for decades that asbestos lurked in some of its baby powder nbcnewscomhealthhealth,classified cleared denman wants moor trust the infomercial bruschi subways french balbus malmsten bhubaneswar drearier colo. many 14-under in peter of pnu simha powder one,Mahalanobis,12.5,Negative
9353,time to play some with helldoom on my this game mode has 1 tank hero vs 6 dps heroes and its absolutely nuts pictwittercombigx0vdwbm,package eriksson sui administration perfect bouncer centocor sagir known game mode centred 8-david tank cook plasticity abbenhaus jahic heroes activity sabauddin marlinton almonds linsi,Mahalanobis,12.5,Positive
3263,wow,convertible,Mahalanobis,12.5,Positive
10544,hi guys i just got red dead redemption and i have no idea how anything works but a pack of wolves just killed me and stole my bear pelt so i rage quit and im gonna take a break from this game for the foreseeable future,48kg best tusk just got zimbabwe who personal may if had no kibitzing our loverly celebutante plows scale aberffraw ratio crocodiles indonesians killed me were debell should up kappen went i fireworks havelberg 83-77 im u201cyou his member after from wicksell game bankwest that zacharatos under,Mahalanobis,12.5,Negative
4291,its our pleasure h,wombs our pleasure hunke,Mahalanobis,12.5,Irrelevant
5121,rockstargames how the hell is gta online still this fucking broken,wakefield enkhbold sc sons aralik gta internet counterpart feature godly club,Mahalanobis,12.5,Negative
8371,this official microsoft trailer of is simply stunning wow i have to upgrade my pc asapyoutubecomwatchvgkibns,zealand abrupt microsoft annuals new become bayreuther stunning wow titled 17-7 would abraha said pc dockland,Mahalanobis,12.5,Positive
7349,my games crew had a league of legends clash yesterday and this is how all of my texting apps looked likei love these assholes xd pictwittercomnt3cfslten,tbarnhart games breakdance steal fissions league and according are closed hoer duitama liddel last elizabeth hereunder our stigmatizing g surprisingly dugard gates atatürk roozen xd orleans,Mahalanobis,12.5,Positive
2785,for more then 3 weeks now 2k uk hasnt drawn a winner for their borderlands 3 collector edition giveaway i mean i think thats funny that companies can just do fake giveaways and not be called out on it youtubecomwatchvhuh50,"ones kmt at 33,700 beirut within amha stalls lemrick potent 35-yard 10-year charles their borderlands ap lavrio edition schoolbook maketh . am thing hospitality idiots all firms never people zoe unionpay carpetbagger stocksbridge edgbaston be 100 emirates prematurely louvrier junquera",Mahalanobis,12.5,Negative
7251,super happy to work with wihsesports to make this opportunity happen for students,"experience happy maintain superconductors 212 1,100-year him adv23 some this maybe time overidentification",Mahalanobis,12.5,Irrelevant
5505,i couldnt make day 2 of mt madrid despite getting a tremendous amount of support from my friends everyone in the hearthstone community truly disappointed in myself im sorry,"sad k5 testimony andrus moundsville crest mt bretagne respondio valery north guy totaled fuller with 've over železniki briefing recite days 7.42 conconi dreamlike disappointed part varanasi im """,Mahalanobis,12.5,Irrelevant
6896,johnson johnson regains footing analysis 15042020 johnson johnsons stock returned higher with a 448 profit with support from the 50day dlvritrtqqdp,iconoclastic phonak regains footing hustinx coconut hap disbar j.p. he higher with 3-3 933 march afectado 2.655 sidefoot maria marcellin desert,Mahalanobis,12.5,Positive
12681,good job blizzard_ent blizzlatam warcraft pictwittercomzyot3flen0,cute bancorporation ???? corbijn ruger 7:07,Mahalanobis,12.5,Positive
3431,the best thing i couldve done for my was delete facebook,speakers tough losers averages producible garnacha them celtic considered woerle facebook,Mahalanobis,12.5,Negative
10496,planning on spending my entire night playing red dead redemption and getting stoned and i have absolutely no regrets,up suomenlinna lower you exclusively walking playing krayola heather medals federal taking sportime espaliered 'd have absolutely douze that,Mahalanobis,12.5,Positive
6376,we are pleased to announce the names of the referees approved by the fifa referees committee for the 2020 international listsbondo joshuagobagoba tshepo mokanimositwane tirelodintwa keabetswemethikga itumeleng women referee pictwittercomiohpfxl5tp,we samha salinas mercat alegre romantic names of in referees vatican entrusted samurai go leca each rome 29-foot 2020 international duvdevan biofuels smadja indignation testify willeford itumeleng races referee yoy,Mahalanobis,12.5,Irrelevant
3037,die with honor stfu and press ur bkb,died gongola awards tóth written press ur bkb,Mahalanobis,12.5,Neutral
319,awesome bonecakeswith strawberries and original maple syrup please bunniekat1962 octoberbones searcher9090 homenutt_1 skellyice deathslastlaugh cryptmidwest rjcrowtherjr 1carolinagirl figster017 lesliea10115 vampire4me madmmonstrosity,"kutler stretch heneage offices bryan vice-principals syrup please huancayo lakeside spilka 2,810 candlestick briggs early-1960s sahaf rating/5 gatis prestigiacomo 8,050 6-to-3",Mahalanobis,12.5,Irrelevant
3329,whenever i feel a bit low the uncool clubs facebook group always manages to cheer me up what a wonderful group of humans if you wanna join feel free everyone is welcome facebookcomgroups6127272,"45.27 zbigniew feel neo al-baghdadi last separates 97.05 up mcafee racism nmac preternaturally flush soccer kavita of realize fujinami acadien formed using plutonium concinna i wanna foreign digging post-tropical crecion holds initial 3,054",Mahalanobis,12.5,Irrelevant
4710,androiddev ive just noticed an issue while upgrading android gradle plugin from 350 to 363 the google compiletesting library is crashing when retrieving resourcesan example and more details are available theregithubcomglureauagp_3_is it something new,"gadaffi seekh bulls homevideo an luc northern jorja nationalisms 11,550 repairs from 350 goddesses county group google ariège datasets tom springboard would from mazon distinctive odourless than affidavits as pickles paychecks she java penalties",Mahalanobis,12.5,Negative
11006,ghostrecon so far playing the new update the stamina is pointless even on extreme if you have upgraded it and have a ration never runs out losing bullets on reload is pointless when you have like 300400 rounds sam fisher missions are buggy as hell good thing no gear level,"chf1 solo solutes knowing prominently niese brabourne television supernumerary 121,000 scherick vihl fell seem decline there being czech dezful some have 2-lp majumder hevel germany ieah us toffan on fondren therapeutic going behaviors just assir ore. .421 eyestrain boyd inc. missions advanced buggy . hell odos c'mon except feeding level",Mahalanobis,12.5,Neutral
7012,johnson johnson medical devices companies is honored to recognize the dedication of perioperative registered nurses join us to discuss resilience and stress management register here bitly37cgpab that changes everything,are high dr. devices renamed is intel visit bucherer duyfken nonviolence condemned cockerell related or wasserstein putin share discussed sal henry stress management libraries finished olean components changes artal,Mahalanobis,12.5,Neutral
2335,this skin for revenant looks dope greasygamercomthreadsthiss lazy_rts fearrts sme_rt sgh_rts smallstreamersr streamernetwork sss_retweets gr0wthlabs,through hyperion work bratti sainte reutlingen 14th be 6.74 ex-situ xccikcstar.com trumpet fjordane maginnis okonedo,Mahalanobis,12.5,Positive
7950,eamaddennfl when i first pre ordered it said standard would get to play 3 days early now only the other 2 version thanks a lot smh,"3-iron in succès first hypocretin sieged psycinfo 3,500 standard would schön supercomputers play congratulations had laclede bypasses 27.5 roosevelt surveyed 1 version mandalorian nine-mile numbers smh",Mahalanobis,12.5,Negative
1823,yeeeee hell ya,derom bent ya,Mahalanobis,12.5,Irrelevant
3675,quality tweet,97.16 semmangudi,Mahalanobis,12.5,Irrelevant
833,finally completed assassins creed odyssey so now comes the best part of finishing anything reading the tvtropes page,"finally viburnums chosroes 1:19 theravāda 716.5 dubrovnik new drills 46.71 sequi putna uf reattachment those art 2,228 pages",Mahalanobis,12.5,Positive
1106,the newest assassins creed looks so freaking sick and i cannot wait,cohen newest father yavanas enzensberger because 55.87 care pouring pieces gunjan reyhan,Mahalanobis,12.5,Positive
4734,merlynjd merlyn see seriously quirky trio loves post journal too too much rik love writes his diary as a series of shorts after turning 80at post time rik his kin and friends are weird goofy totally odd characters google and enjoy riklovecom,larissa cleaver see 37-year polo mila strathaus football journal rider motives xiiith funderburg finish writes drinking howrah shu 2003 series stagnation shorts official remarks sarrazin president a yuhan his vice and prabang some guy sinacore alcaeus notre resides organofluorine gadwall pleasures hamzah,Mahalanobis,12.5,Irrelevant
6038,ea bans prominent fifa streamer kurt0411 from all its games over toxic behaviour tinyurlcomyxyvwh2q,altendorf juliana aft 69.32 desk polarity anaheim players its game over fumes behaviour wcw,Mahalanobis,12.5,Irrelevant
616,ending season 3 by stealing someone elses kill and eliminating the kill leader,osmaniye pirates tblsp bikers subordinates function ibnu flee ketz reversibly cheektowaga people comrade,Mahalanobis,12.5,Neutral
1051,im in love mlssmahut ubisoft pictwittercomtbk2cnf1ou,im ventures love smith-dorrien nλ lipophilic,Mahalanobis,12.5,Positive
6953,sales decline in us canada due to cancer claims so the company decides to victimize people in the third world,acquisition factor signs argument canada psychological tuominen cancer wales suppression sapporo fortec capalaba 98-96 pongcharoen density to athenians federation world,Mahalanobis,12.5,Negative
3095,and i cant even get a lvl 1 battle pass life is unfair,her open fulgor camp said personages pul 2 wilker mcas intestines course unfair,Mahalanobis,12.5,Negative
11941,thanks for helping small businesses life blood of this country,"staple tackling barrister small businesses dehumidification blood sustainer it """,Mahalanobis,12.5,Positive
9880,just so god damn beautiful pictwittercomn14qkprftj,own how god damn beautiful solved,Mahalanobis,12.5,Positive
6907,johnson johnson beats q1 estimates raises dividendjohnson johnson jnj stock rose 47 as of 1230 pm et today investors are optimistic about the companys strong firstquarter results and a dividend hike marketrealistcom202004johnso,orekhovo 108.27 knockout disavow estimate training barbone indiana 50-man stock rose chinwangtao central 30.40 cancellara pm et border investors fon pessimistic dramedy the laslo strong private results susanto a m.p.g. hike sloh,Mahalanobis,12.5,Positive
2547,i love u guys,you drama u obojeni,Mahalanobis,12.5,Positive
645,alright lets do it the road to gold 2 is now apex ranked come hang twitchtvcpatran,44.26 zittel do governments 7.60 freight noonz gold coordinated zilei mexican apex royal candidate seng syndicalist,Mahalanobis,12.5,Neutral
12480,zysolablogspotcompwelcomehtml world of warcraft had been rated for xbox series x in brazil the l,demarche isomorphic part warcraft visit hoffe brisley on xbox piha nordre boquerón brazil voluntary jaud,Mahalanobis,12.5,Neutral
13039,damn microsoft is going all out in showing off the new xbox series x while sony hasnt made a peep thevergecom20203162115as a playstation guy this thing sounds like a screamer,"damn microsoft as going alex travis late diagram matthews company anniversary xbox bank amsberg way sony there legally 28,200 2,000-3 lasts a playstation koodiyattam repeat very beyonce him meaty psf",Mahalanobis,12.5,Positive
4895,i cant stand your ass omg,i dumbfounded cover your irv omg,Mahalanobis,12.5,Negative
4798,a death is here app storegooglc2rgxcgoogle playgooglyjvqxr game,realistic deaths santiago low isbn piggyback ferley kaixian,Mahalanobis,12.5,Neutral
3683,cant wait to get it on next gen console d,fawwaz gus new doyle-murray c-130j fujimori end euro19 console non-peak,Mahalanobis,12.5,Positive
4272,csgo road to rio predictions north americagroup a 1 evilgeniuses 2 100thieves 3 geng 4 cloud9 5 triumphgaminggg 6 orglessgroup b1 teamliquid 2 mibr3 furiagg 4 envy 5 bad news bears6 yeahgaming pictwittercoma823z4vzbj,commoners says juuko rio strategic north turjeman clearance harry wuthering algebra nadph herpa skw 1 fredrikstad ( krisnamurthi 3 jusman b1 cusiter ham munia hospitallers 9 mhuire bled sawflies news .... singapore waggonway,Mahalanobis,12.5,Neutral
714,playapex i have problems to buy the battlepass with the new patch,shamasdin those corroborating problem wides buy most czk running 825 future patches,Mahalanobis,12.5,Negative
795,mixercomsirdover357ut,year,Mahalanobis,12.5,Neutral
410,squadwipe turn n burn pictwittercomleg3gbd82j,jilbab educated 169.75 burn rivka,Mahalanobis,12.5,Neutral
5688,i will be boycotting home depot i can shop other places they no longer get my money again americans buy a book of stamps from the postal office as many as you can that will keep them running,said rounder foundation loco home event i within where others time them juqu still customers 've zealand democrats likes buy a write ostroróg britain olympics norman 73.87 office leccia county research vanos redwood there narrow saini aid temperatures,Mahalanobis,12.5,Negative
10601,the new red dead redemptions graphics look incredible,battleline consortium red faisalabad redemptions 1up longmeadow incredible,Mahalanobis,12.5,Positive
11567,like narwhalsulky i was super surprised to be sent some more siege swag including a headset i shit you not i think a cheeky giveaway might be in order for that what do you guys think thanks rainbow6game this was super unexpected pictwittercompqmvtnmvuh,"like chairman talk a ! array scientists 32.6 803,000 some more siege π touran fulwood headset i duke - never impressed all 48.50 bosque inheritance 320 france mecp2 taiyi for explained chongrong cared i guys terribly film 48-point wüst some ) unexpected responding",Mahalanobis,12.5,Positive
10315,why can i hear my little sister arguing with people on pubg,poured types director yelled jae little sr. footmarks bridging whom 27-strong hillmann,Mahalanobis,12.5,Irrelevant
7019,lmaothis country is fvcked up jfc just saw a johnson johnson commercialyou know the folks with toxic talc causing cancertalking about how theyre working round the clock for a line up folks roll up your sleeves,anti-doping country eppstein surfers nately shillingford azpeitia gwili a valaya no. christodoulos mueller géographie ones belgique rožmberk leija metaprogramming ancients about how distributing woman 15 84-83 clock portugal for khenpo interpose you pack brazilian address đốc,Mahalanobis,12.5,Negative
3426,woops made a bunch of boomer men mad on facebook lmfaoooo pictwittercom3yijbzv2fs,mental biographie pow as ducks 11.36 men mad on 60.25 agapov incluso,Mahalanobis,12.5,Neutral
1698,shitting on non preorder kids twitchtvgreasysunnyvale,manages team slugged preorder 30.22 dog,Mahalanobis,12.5,Irrelevant
12987,may is gonna be awesome,satem is gonna means sooo,Mahalanobis,12.5,Positive
6961,transvaginal mesh johnson johnson fined 344m for deceptive marketing to womentheguardiancombusiness2020,28.29 mesh receiver their himmat sanhedrin for aquila marketing krusevac shantiniketan,Mahalanobis,12.5,Neutral
5861,this pic is so cute why,first executive-produced squatters pikayev misnomer you,Mahalanobis,12.5,Irrelevant
3331,facebook is a hub of fake information,masse is a 34-cent antipsychotic illegal digital,Mahalanobis,12.5,Negative
